{
  "$schema": "http://json-schema.org/draft-07/schema",
  "type": "object",
  "required": [
    "meta"
  ],
  "definitions": {
    "string": {
      "type": "string",
      "minLength": 1
    },
    "array": {
      "type": "array",
      "minItems": 1,
      "uniqueItems": true
    },
    "array-items-string": {
      "allOf": [
        {
          "$ref": "#/definitions/array"
        },
        {
          "items": {
            "type": "string",
            "minLength": 1
          }
        }
      ]
    },
    "array-items-text": {
      "allOf": [
        {
          "$ref": "#/definitions/array"
        },
        {
          "items": {
            "type": [
              "string",
              "object"
            ],
            "if": {
              "type": "string"
            },
            "then": {
              "$ref": "#/definitions/string"
            },
            "else": {
              "required": [
                "cmd",
                "desc"
              ],
              "properties": {
                "cmd": {
                  "$ref": "#/definitions/string"
                },
                "desc": {
                  "$ref": "#/definitions/string"
                }
              },
              "additionalProperties": false
            }
          }
        }
      ]
    },
    "name": {
      "markdownDescription": "The item's canonical name — its **longest** form.\n\n- Put the shorter spellings in `alias`\n- Quote a value containing spaces",
      "examples": [
        ""
      ],
      "allOf": [
        {
          "$ref": "#/definitions/string"
        },
        {
          "if": {
            "pattern": " "
          },
          "then": {
            "pattern": "(^\".+\"$)|(^'.+'$)",
            "errorMessage": "If spaces are needed, please use \" or ' to wrap them, for example: 'hello world'"
          }
        }
      ]
    },
    "alias": {
      "markdownDescription": "Alternative spellings for this item, ordered **longest → shortest**.\n\n- The canonical name stays in `name`; aliases are only the remaining forms\n- `usage` must show every alias, and there it appears in the **opposite** order (shortest first)",
      "examples": [
        []
      ],
      "allOf": [
        {
          "$ref": "#/definitions/array-items-string"
        },
        {
          "items": {
            "if": {
              "pattern": " "
            },
            "then": {
              "pattern": "(^\".+\"$)|(^'.+'$)",
              "errorMessage": "If spaces are needed, please use \" or ' to wrap them, for example: 'hello world'"
            }
          }
        }
      ]
    },
    "tip": {
      "markdownDescription": "Completion item description (shown as the `[Description]` section).\n- The `usage` and `example` fields hold the usage/example lines separately.\n- Here is an example:\n```json\n  \"tip\": [\n    \"Add file changes to the index.\"\n  ]\n  ```",
      "examples": [
        []
      ],
      "allOf": [
        {
          "$ref": "#/definitions/array-items-string"
        },
        {
          "not": {
            "contains": {
              "pattern": "[\\r\\n]"
            }
          },
          "errorMessage": "Each item in the array will automatically add a line break at the end when displayed, so line breaks are not allowed."
        },
        {
          "items": {
            "not": {
              "pattern": "[\\u4e00-\\u9fff][A-Za-z]|[A-Za-z][\\u4e00-\\u9fff]"
            },
            "errorMessage": "tip: Chinese and English must be separated by a space"
          }
        }
      ]
    },
    "repeat": {
      "type": "integer",
      "markdownDescription": "Maximum number of times this item may appear.\n\n- Use `99` only when the limit is unknown or effectively unlimited\n- The item stops being offered once the limit is reached",
      "minimum": 1,
      "examples": [
        1,
        2,
        3,
        4,
        5,
        99
      ]
    },
    "separator": {
      "type": "string",
      "markdownDescription": "List separator for an option's value.\n-  Complete by segment (selecting replaces the current segment; the user types the separator to continue).\n- Options only; requires `next`.\n- Whitespace and `=` are forbidden.",
      "examples": [
        ",",
        ";",
        ":",
        "/",
        "|"
      ],
      "allOf": [
        {
          "minLength": 1
        },
        {
          "pattern": "^[^\\s=]+$",
          "errorMessage": "It must not contain whitespace or `=`"
        }
      ]
    },
    "usage": {
      "markdownDescription": "Completion item usage lines (shown as the `[Usage]` section).\n- Optional; if absent, no usage section is shown.\n- Each item is a plain string, or an object `{ \"cmd\": ..., \"desc\": ... }` — in object form **both** `cmd` and `desc` are required (use a plain string when there is no explanation).\n- Example:\n```json\n  \"usage\": [\"-r, --revisions <REVSETS>\", { \"cmd\": \"add|install <APP>\", \"desc\": \"install a package\" }]\n```",
      "examples": [
        []
      ],
      "allOf": [
        {
          "$ref": "#/definitions/array-items-text"
        },
        {
          "items": {
            "oneOf": [
              {
                "type": "string",
                "not": {
                  "pattern": "[\\u4e00-\\u9fff][A-Za-z]|[A-Za-z][\\u4e00-\\u9fff]"
                },
                "errorMessage": "usage: Chinese and English must be separated by a space"
              },
              {
                "type": "object",
                "properties": {
                  "cmd": {
                    "not": {
                      "pattern": "[\\u4e00-\\u9fff][A-Za-z]|[A-Za-z][\\u4e00-\\u9fff]"
                    },
                    "errorMessage": "usage.cmd: Chinese and English must be separated by a space"
                  },
                  "desc": {
                    "not": {
                      "pattern": "[\\u4e00-\\u9fff][A-Za-z]|[A-Za-z][\\u4e00-\\u9fff]"
                    },
                    "errorMessage": "usage.desc: Chinese and English must be separated by a space"
                  }
                }
              }
            ]
          }
        }
      ]
    },
    "example": {
      "markdownDescription": "Completion item example lines (shown as the `[Example]` section).\n- Optional; if absent, no example section is shown.\n- Each item is a plain string, or an object `{ \"cmd\": ..., \"desc\": ... }` — in object form **both** `cmd` and `desc` are required (use a plain string when there is no explanation).\n- Example:\n```json\n  \"example\": [\"-r '@-'\", { \"cmd\": \"d demo.zip *.bak -r\", \"desc\": \"delete all .bak files\" }]\n```",
      "examples": [
        []
      ],
      "allOf": [
        {
          "$ref": "#/definitions/array-items-text"
        },
        {
          "items": {
            "oneOf": [
              {
                "type": "string",
                "not": {
                  "pattern": "[\\u4e00-\\u9fff][A-Za-z]|[A-Za-z][\\u4e00-\\u9fff]"
                },
                "errorMessage": "example: Chinese and English must be separated by a space"
              },
              {
                "type": "object",
                "properties": {
                  "cmd": {
                    "not": {
                      "pattern": "[\\u4e00-\\u9fff][A-Za-z]|[A-Za-z][\\u4e00-\\u9fff]"
                    },
                    "errorMessage": "example.cmd: Chinese and English must be separated by a space"
                  },
                  "desc": {
                    "not": {
                      "pattern": "[\\u4e00-\\u9fff][A-Za-z]|[A-Za-z][\\u4e00-\\u9fff]"
                    },
                    "errorMessage": "example.desc: Chinese and English must be separated by a space"
                  }
                }
              }
            ]
          }
        }
      ]
    },
    "item": {
      "type": "object",
      "required": [
        "name"
      ],
      "dependencies": {
        "separator": [
          "next"
        ]
      },
      "properties": {
        "name": {
          "$ref": "#/definitions/name"
        },
        "alias": {
          "$ref": "#/definitions/alias"
        },
        "tip": {
          "$ref": "#/definitions/tip"
        },
        "usage": {
          "$ref": "#/definitions/usage"
        },
        "example": {
          "$ref": "#/definitions/example"
        },
        "repeat": {
          "$ref": "#/definitions/repeat"
        },
        "separator": {
          "$ref": "#/definitions/separator"
        },
        "next": {
          "$ref": "#/definitions/next-for-option"
        },
        "option": {
          "$ref": "#/definitions/option"
        }
      },
      "additionalProperties": false
    },
    "next-item": {
      "type": "object",
      "required": [
        "name"
      ],
      "properties": {
        "name": {
          "$ref": "#/definitions/name"
        },
        "alias": {
          "$ref": "#/definitions/alias"
        },
        "tip": {
          "$ref": "#/definitions/tip"
        },
        "usage": {
          "$ref": "#/definitions/usage"
        },
        "example": {
          "$ref": "#/definitions/example"
        },
        "next": {
          "$ref": "#/definitions/next"
        },
        "option": {
          "$ref": "#/definitions/option"
        }
      },
      "additionalProperties": false
    },
    "next": {
      "markdownDescription": "Next subcommand completion (**commands only**)\n- Must be a **non-empty array** — a subcommand either has a next level (its subcommands) or none at all.\n- A command's parameter value (if any) is expressed by the `usage` placeholder, never by `next`.\n- Items in the array are automatically added to the completions.",
      "type": "array",
      "minItems": 1,
      "uniqueItems": true,
      "items": {
        "$ref": "#/definitions/next-item"
      }
    },
    "next-for-option": {
      "markdownDescription": "Next completion for an **option** (candidate values)\n- Must be an **array**.\n- A **non-empty** array lists static candidate values (selecting one records it as the option's `value`; an out-of-list word is `unknown`).\n- An **empty** array `[]` means \"no static candidates\".",
      "type": "array",
      "uniqueItems": true,
      "items": {
        "$ref": "#/definitions/next-item"
      }
    },
    "require_next": {
      "if": {
        "properties": {
          "usage": {
            "contains": {
              "type": "string",
              "pattern": "^[^#]*<[^<>]*>"
            }
          }
        },
        "required": [
          "usage"
        ]
      },
      "then": {
        "required": [
          "next"
        ]
      }
    },
    "option": {
      "type": "array",
      "uniqueItems": true,
      "minItems": 1,
      "markdownDescription": "Next optional completion\n - Usually starts with `-` or `--`\n - For example, `--list`",
      "items": {
        "allOf": [
          {
            "$ref": "#/definitions/item"
          },
          {
            "$ref": "#/definitions/require_next"
          }
        ]
      }
    }
  },
  "properties": {
    "meta": {
      "type": "object",
      "description": "Additional information for the completion command",
      "required": [
        "url",
        "description"
      ],
      "properties": {
        "url": {
          "description": "Homepage or repository address of the completion command",
          "format": "uri",
          "allOf": [
            {
              "$ref": "#/definitions/string"
            },
            {
              "pattern": "^https?://",
              "errorMessage": "It must be a valid http/https URL"
            },
            {
              "not": {
                "pattern": "/$"
              },
              "errorMessage": "URL must not end with a trailing slash"
            }
          ]
        },
        "description": {
          "description": "Description of the completion command",
          "allOf": [
            {
              "$ref": "#/definitions/array-items-string"
            },
            {
              "not": {
                "contains": {
                  "pattern": "\\n"
                }
              },
              "errorMessage": "Each item in the array will automatically add a line break at the end when displayed, so line breaks are not allowed."
            },
            {
              "items": {
                "not": {
                  "pattern": "[\\u4e00-\\u9fff][A-Za-z]|[A-Za-z][\\u4e00-\\u9fff]"
                },
                "errorMessage": "meta.description: Chinese and English must be separated by a space"
              }
            }
          ]
        }
      },
      "additionalProperties": false
    },
    "next": {
      "description": "Subcommand completion for the root command",
      "allOf": [
        {
          "$ref": "#/definitions/array"
        },
        {
          "items": {
            "$ref": "#/definitions/next-item"
          }
        }
      ]
    },
    "option": {
      "markdownDescription": "Optional completion for the root command",
      "allOf": [
        {
          "$ref": "#/definitions/array"
        },
        {
          "items": {
            "allOf": [
              {
                "$ref": "#/definitions/item"
              },
              {
                "$ref": "#/definitions/require_next"
              }
            ]
          }
        }
      ]
    },
    "global_option": {
      "markdownDescription": "Global optional completion\n- Any time you trigger completion, they will be displayed\n- Unless you have used it or its alias",
      "allOf": [
        {
          "$ref": "#/definitions/array"
        },
        {
          "items": {
            "allOf": [
              {
                "$ref": "#/definitions/item"
              },
              {
                "$ref": "#/definitions/require_next"
              }
            ]
          }
        }
      ]
    },
    "config": {
      "description": "Special configuration items for the completion command",
      "allOf": [
        {
          "$ref": "#/definitions/array"
        },
        {
          "items": {
            "type": "object",
            "required": [
              "name",
              "value",
              "tip"
            ],
            "properties": {
              "name": {
                "description": "Name of the special configuration item",
                "allOf": [
                  {
                    "$ref": "#/definitions/string"
                  }
                ]
              },
              "value": {
                "description": "Default value of the special configuration item",
                "type": [
                  "string",
                  "number"
                ]
              },
              "values": {
                "markdownDescription": "Optional values of the special configuration item\n- Here, you can fill in the values that will be displayed when the command completion is triggered\n - Suppose the command completion is `xxx` and the configuration item name is `enable_xxx`\n - Then, when you input `psc completion xxx enable_xxx` and trigger completion, the values in the `values` array will be displayed in the completion list",
                "allOf": [
                  {
                    "items": {
                      "type": [
                        "string",
                        "number"
                      ]
                    }
                  },
                  {
                    "$ref": "#/definitions/array"
                  }
                ]
              },
              "tip": {
                "description": "Tip information for the special configuration item",
                "allOf": [
                  {
                    "$ref": "#/definitions/array-items-string"
                  }
                ]
              }
            },
            "if": {
              "properties": {
                "name": {
                  "pattern": "^(enable|disable)"
                }
              }
            },
            "then": {
              "properties": {
                "value": {
                  "enum": [
                    0,
                    1
                  ]
                },
                "values": {
                  "const": [
                    0,
                    1
                  ]
                }
              }
            },
            "additionalProperties": false
          }
        }
      ]
    },
    "info": {
      "markdownDescription": "Free-form data for hooks, read as `psc.manifest.info`.",
      "type": "object",
      "minProperties": 1
    }
  },
  "additionalProperties": false
}
