{
  "meta": {
    "url": "https://carapace.sh/",
    "description": [
      "A multi-shell completion binary"
    ]
  },
  "next": [
    {
      "name": "_carapace",
      "usage": [
        "_carapace <SHELL>"
      ],
      "tip": [
        "Generate completion script for the specified shell"
      ],
      "next": [
        {
          "name": "bash",
          "tip": [
            "Generate bash completion"
          ]
        },
        {
          "name": "bash-ble",
          "tip": [
            "Generate bash-ble completion"
          ]
        },
        {
          "name": "cmd-clink",
          "tip": [
            "Generate cmd-clink completion"
          ]
        },
        {
          "name": "elvish",
          "tip": [
            "Generate elvish completion"
          ]
        },
        {
          "name": "export",
          "tip": [
            "Generate export completion"
          ]
        },
        {
          "name": "fish",
          "tip": [
            "Generate fish completion"
          ]
        },
        {
          "name": "ion",
          "tip": [
            "Generate ion completion"
          ]
        },
        {
          "name": "nushell",
          "tip": [
            "Generate nushell completion"
          ]
        },
        {
          "name": "oil",
          "tip": [
            "Generate oil completion"
          ]
        },
        {
          "name": "powershell",
          "tip": [
            "Generate powershell completion"
          ]
        },
        {
          "name": "tcsh",
          "tip": [
            "Generate tcsh completion"
          ]
        },
        {
          "name": "xonsh",
          "tip": [
            "Generate xonsh completion"
          ]
        },
        {
          "name": "zsh",
          "tip": [
            "Generate zsh completion"
          ]
        }
      ]
    },
    {
      "name": "selfupdate",
      "usage": [
        "selfupdate [SOURCE] [TAG] [ASSET]"
      ],
      "tip": [
        "Update to nightly/stable releases"
      ],
      "option": [
        {
          "name": "--all",
          "alias": [
            "-a"
          ],
          "usage": [
            "-a, --all"
          ],
          "tip": [
            "Show all tags/assets"
          ]
        },
        {
          "name": "--force",
          "alias": [
            "-f"
          ],
          "usage": [
            "-f, --force"
          ],
          "tip": [
            "Force update"
          ]
        }
      ]
    }
  ],
  "option": [
    {
      "name": "--choice",
      "usage": [
        "--choice [VARIANT]..."
      ],
      "tip": [
        "List or edit choices"
      ],
      "option": [
        {
          "name": "--delete",
          "alias": [
            "-d"
          ],
          "usage": [
            "-d, --delete"
          ],
          "tip": [
            "Delete given choice(s)"
          ]
        }
      ],
      "next": []
    },
    {
      "name": "--clear-cache",
      "tip": [
        "Clear caches"
      ]
    },
    {
      "name": "--codegen",
      "usage": [
        "--codegen <SPEC>"
      ],
      "tip": [
        "Generate code for spec file"
      ],
      "next": []
    },
    {
      "name": "--condition",
      "usage": [
        "--condition [CONDITION]"
      ],
      "tip": [
        "List or execute condition"
      ],
      "next": []
    },
    {
      "name": "--detect",
      "usage": [
        "--detect <COMMAND>"
      ],
      "tip": [
        "Detect bridge by invoking command"
      ],
      "next": []
    },
    {
      "name": "--diff",
      "usage": [
        "--diff <COMPLETER> <COMPLETER> [...ARGS]"
      ],
      "tip": [
        "Diff completion"
      ],
      "next": []
    },
    {
      "name": "--edit",
      "usage": [
        "--edit <FILE>..."
      ],
      "tip": [
        "Edit files"
      ],
      "next": []
    },
    {
      "name": "--list",
      "tip": [
        "List completers"
      ],
      "option": [
        {
          "name": "--all",
          "tip": [
            "Return unfiltered results"
          ]
        },
        {
          "name": "--init",
          "tip": [
            "Update shims"
          ]
        },
        {
          "name": "--names",
          "tip": [
            "Only list names"
          ]
        }
      ]
    },
    {
      "name": "--macro",
      "usage": [
        "--macro [MACRO] [...ARGS]"
      ],
      "tip": [
        "List or execute macros"
      ],
      "next": []
    },
    {
      "name": "--mcp",
      "tip": [
        "Run MCP server"
      ]
    },
    {
      "name": "--run",
      "usage": [
        "--run <SPEC> [...ARGS]"
      ],
      "tip": [
        "Run spec"
      ],
      "next": []
    },
    {
      "name": "--schema",
      "tip": [
        "Json schema for spec files"
      ]
    },
    {
      "name": "--style",
      "usage": [
        "--style <KEY>=<VALUE>"
      ],
      "tip": [
        "Set style"
      ],
      "next": []
    },
    {
      "name": "--version",
      "alias": [
        "-v"
      ],
      "usage": [
        "-v, --version"
      ],
      "tip": [
        "Show version"
      ]
    }
  ],
  "global_option": [
    {
      "name": "--help",
      "alias": [
        "-h"
      ],
      "usage": [
        "-h, --help"
      ],
      "tip": [
        "Show help"
      ]
    }
  ]
}
