{
  "meta": {
    "url": "https://tombi-toml.github.io/tombi/",
    "description": [
      "TOML Toolkit"
    ]
  },
  "next": [
    {
      "name": "completion",
      "tip": [
        "U: completion <SHELL>",
        "Generate shell completion"
      ],
      "next": [
        {
          "name": "bash",
          "tip": [
            "Generate bash completion script"
          ]
        },
        {
          "name": "elvish",
          "tip": [
            "Generate elvish completion script"
          ]
        },
        {
          "name": "fish",
          "tip": [
            "Generate fish completion script"
          ]
        },
        {
          "name": "powershell",
          "tip": [
            "Generate powershell completion script"
          ]
        },
        {
          "name": "zsh",
          "tip": [
            "Generate zsh completion script"
          ]
        }
      ]
    },
    {
      "name": "format",
      "tip": [
        "Format TOML files"
      ],
      "option": [
        {
          "name": "--check",
          "tip": [
            "Check only and don't overwrite files"
          ]
        },
        {
          "name": "--diff",
          "tip": [
            "Show format changes"
          ]
        },
        {
          "name": "--no-cache",
          "tip": [
            "Do not use cache"
          ]
        },
        {
          "name": "--offline",
          "tip": [
            "Disable network access"
          ]
        },
        {
          "name": "--quiet",
          "tip": [
            "Quiet mode"
          ]
        },
        {
          "name": "--stdin-filename",
          "tip": [
            "U: --stdin-filename <STDIN_FILENAME>",
            "Filename to use when reading from stdin"
          ],
          "next": 0
        }
      ]
    },
    {
      "name": "lint",
      "tip": [
        "Lint TOML files"
      ],
      "option": [
        {
          "name": "--error-on-warnings",
          "tip": [
            "Exit with error code on warnings"
          ]
        },
        {
          "name": "--no-cache",
          "tip": [
            "Do not use cache"
          ]
        },
        {
          "name": "--offline",
          "tip": [
            "Disable network access"
          ]
        },
        {
          "name": "--quiet",
          "tip": [
            "Quiet mode"
          ]
        },
        {
          "name": "--stdin-filename",
          "tip": [
            "U: --stdin-filename <STDIN_FILENAME>",
            "Filename to use when reading from stdin"
          ],
          "next": 0
        }
      ]
    },
    {
      "name": "lsp",
      "tip": [
        "Run TOML Language Server"
      ],
      "option": [
        {
          "name": "--no-cache",
          "tip": [
            "Do not use cache"
          ]
        },
        {
          "name": "--offline",
          "tip": [
            "Disable network access"
          ]
        }
      ]
    }
  ],
  "option": [
    {
      "name": "--verbose",
      "alias": [
        "-v"
      ],
      "tip": [
        "U: -v, --verbose",
        "Change the logging level",
        "-v: DEBUG, -vv: TRACE"
      ],
      "repeat": 2
    },
    {
      "name": "--version",
      "alias": [
        "-V"
      ],
      "tip": [
        "U: -V, --version",
        "Print version"
      ]
    }
  ],
  "global_option": [
    {
      "name": "--help",
      "alias": [
        "-h"
      ],
      "tip": [
        "U: -h, --help",
        "Print help"
      ]
    }
  ]
}
